goal,subgoal,indicator,permalink,title,new,notes
1,b,1,1-b-1,"Proportion of government recurrent and capital spending to sectors that disproportionately benefit women, the poor and vulnerable groups",Yes,
1,a,2,1-a-2,"Proportion of total government spending on essential services (education, health and social protection)",No,
1,a,1,1-a-1,Proportion of resources allocated by the government directly to poverty reduction programmes,No,
1,5,3,1-5-3,Number of countries with national and local disaster risk reduction strategies*,Yes,
1,5,2,1-5-2,Direct disaster economic loss in relation to global gross domestic product (GDP)*,Yes,
1,5,1,1-5-1,"Number of deaths, missing persons and persons affected by disaster per 100,000 people*",No,
1,4,2,1-4-2,"Proportion of total adult population with secure tenure rights to land, with legally recognized documentation and who perceive their rights to land as secure, by sex and by type of tenure",Yes,
1,4,1,1-4-1,Proportion of population living in households with access to basic services,No,
1,3,1,1-3-1,"Proportion of population covered by social protection floors/systems, by sex, distinguishing children, unemployed persons, older persons, persons with disabilities, pregnant women, newborns, work injury victims and the poor and the vulnerable",No,
1,2,2,1-2-2,"Proportion of men, women and children of all ages living in poverty in all its dimensions according to national definitions",No,
1,2,1,1-2-1,"Proportion of population living below the national poverty line, by sex and age",No,
1,1,1,1-1-1,"Proportion of population below the international poverty line, by sex, age, employment status and geographical location (urban/rural)",No,
2,c,1,2-c-1,Indicator of food price anomalies,,
2,b,2,2-b-2,Agricultural export subsidies,No,
2,b,1,2-b-1,Producer Support Estimate,Yes,
2,a,2,2-a-2,Total official flows (official development assistance plus other official flows) to the agriculture sector,Yes,"removed ""crops"""
2,a,1,2-a-1,The agriculture orientation index for government expenditures,No,
2,5,2,2-5-2,"Proportion of local breeds classified as being at risk, not-at-risk or at unknown level of risk of extinction",Yes,"new term ""productive"" included"
2,5,1,2-5-1,Number of plant and animal genetic resources for food and agriculture secured in either medium or long-term conservation facilities,Yes,
2,4,1,2-4-1,Proportion of agricultural area under productive and sustainable agriculture,Yes,
2,3,2,2-3-2,"Average income of small-scale food producers, by sex and indigenous status",Yes,
2,3,1,2-3-1,Volume of production per labour unit by classes of farming/pastoral/forestry enterprise size,No,
2,2,2,2-2-2,"Prevalence of malnutrition (weight for height >+2 or <-2 standard deviation from the median of the WHO Child Growth Standards) among children under 5 years of age, by type (wasting and overweight)",No,
2,2,1,2-2-1,Prevalence of stunting (height for age <-2 standard deviation from the median of the World Health Organization (WHO) Child Growth Standards) among children under 5 years of age,No,
2,1,2,2-1-2,"Prevalence of moderate or severe food insecurity in the population, based on the Food Insecurity Experience Scale (FIES)",No,
2,1,1,2-1-1,Prevalence of undernourishment,No,
3,d,1,3-d-1,International Health Regulations (IHR) capacity and health emergency preparedness,No,
3,c,1,3-c-1,Health worker density and distribution,No,
3,b,2,3-b-2,Total net official development assistance to the medical research and basic health sectors,No,
3,b,1,3-b-1,Proportion of the population with access to affordable medicines and vaccines on a sustainable basis,,
3,a,1,3-a-1,Age-standardized prevalence of current tobacco use among persons aged 15 years and older,Yes,
3,9,3,3-9-3,Mortality rate attributed to unintentional,No,
3,9,2,3-9-2,"Mortality rate attributed to unsafe water, unsafe sanitation and lack of hygiene (exposure to unsafe Water, Sanitation and Hygiene for All (WASH) services)",No,
3,9,1,3-9-1,Mortality rate attributed to household and ambient air pollution,No,
3,8,2,3-8-2,"Number of people covered by health insurance or a public health system per 1,000 population",Yes,"Focus on WASH only, removed mention of chemicals and pollution"
3,8,1,3-8-1,"Coverage of essential health services (defined as the average coverage of essential services based on tracer interventions that include reproductive, maternal, newborn and child health, infectious diseases, non-communicable diseases and service capacity and access, among the general and the most disadvantaged population)",Yes,
3,7,2,3-7-2,"Adolescent birth rate (aged 10-14; aged 15-19) per 1,000 women in that age group",No,
3,7,1,3-7-1,Percentage of women of reproductive age (aged 15-49) who have their need for family planning satisfied with modern methods,Yes,
3,6,1,3-6-1,Death rate due to road traffic injuries,No,
3,5,2,3-5-2,"Harmful use of alcohol, defined according to the national context as alcohol per capita consumption (aged 15 years and older) within a calendar year in litres of pure alcohol",No,
3,5,1,3-5-1,"Coverage of treatment interventions (pharmacological, psychosocial and rehabilitation and aftercare services) for substance use disorders",No,
3,4,2,3-4-2,Suicide mortality rate,No,
3,4,1,3-4-1,"Mortality of cardiovascular disease, cancer, diabetes or chronic respiratory disease",No,
3,3,5,3-3-5,Number of people requiring interventions against neglected tropical diseases,No,
3,3,4,3-3-4,"Hepatitis B incidence per 100,000 population",No,
3,3,3,3-3-3,"Malaria incident cases per 1,000 persons per year",No,
3,3,2,3-3-2,"Tuberculosis incidence per 1,000 persons per year",No,
3,3,1,3-3-1,"Number of new HIV infections per 1,000 uninfected population, by sex, age and key populations",No,"""ratio"" replaced ""rate"""
3,2,2,3-2-2,Neonatal mortality rate,No,
3,2,1,3-2-1,Under-five mortality rate,No,
3,1,2,3-1-2,Proportion of births attended by skilled health personnel,No,
3,1,1,3-1-1,Maternal mortality ratio,Yes,
4,c,1,4-c-1,Proportion of teachers in: (a) pre-primary; (b) primary; (c) lower secondary; and (d) upper secondary education who have received at least the minimum organized teacher training (e.g. pedagogical training) pre-service or in-service required for teaching at the relevant level in a given country,No,
4,b,1,4-b-1,Volume of official development assistance flows for scholarships by sector and type of study,No,
4,a,1,4-a-1,Proportion of schools with access to: (a) electricity; (b) the Internet for pedagogical purposes; (c) computers for pedagogical purposes; (d) adapted infrastructure and materials for students with disabilities; (e) basic drinking water; (f) single- sex basic sanitation facilities; and (g) basic handwashing facilities (as per the WASH indicator definitions),No,
4,7,1,4-7-1,"Extent to which (i) global citizenship education and (ii) education for sustainable development, including gender equality and human rights, are mainstreamed at all levels in: (a) national education policies, (b) curricula, (c) teacher education and (d) student assessment",No,
4,6,1,4-6-1,"Percentage of population in a given age group achieving at least a fixed level of proficiency in functional (a) literacy and (b) numeracy skills, by sex",No,
4,5,1,4-5-1,"Parity indices (female/male, rural/urban, bottom/top wealth quintile and others such as disability status, indigenous peoples and conflict- affected, as data become available) for all education indicators on this list that can be disaggregated",No,
4,4,1,4-4-1,Percentage of youth/adults with information and communications technology (ICT) skills by type of skill,No,
4,3,1,4-3-1,Participation rate of youth and adults in formal and non-formal education and training in the last 12 months,Yes,
4,2,2,4-2-2,"Participation rate in organized learning (one year before the official primary entry age), by sex",No,switch from all to only education indicators
4,2,1,4-2-1,"Proportion of children under 5 years of age who are developmentally on track in health, learning and psychosocial well-being, by sex",Yes,
4,1,1,4-1-1,"Proportion of children and young people: (a) in grades 2/3; (b) at the end of primary; and (c) at the end of lower secondary achieving at least a minimum proficiency level in (i) reading and (ii) mathematics, by sex",No,
5,c,1,5-c-1,Percentage of countries with systems to track and make public allocations for gender equality and women’s empowerment,No,
5,b,1,5-b-1,"Proportion of individuals who own a mobile telephone, by sex",No,
5,a,2,5-a-2,Percentage of countries where the legal framework (including customary law) guarantees women’s equal rights to land ownership and/or control,No,
5,a,1,5-a-1,"(a) Percentage of people with ownership or secure rights over agricultural land (out of total agricultural population), by sex; and (b) share of women among owners or rights-bearers of agricultural land, by type of tenure",No,
5,6,2,5-6-2,"Number of countries with laws and regulations that guarantee women aged 15-49 access to sexual and reproductive health care, information and education",No,
5,6,1,5-6-1,"Proportion of women aged 15-49 who make their own informed decisions regarding sexual relations, contraceptive use and reproductive health care",No,
5,5,2,5-5-2,Proportion of women in managerial positions,No,
5,5,1,5-5-1,Proportion of seats held by women in national parliaments and local governments,No,
5,4,1,5-4-1,"Proportion of time spent on unpaid domestic and care work, by sex, age and location",No,
5,3,2,5-3-2,"Percentage of girls and women aged 15-49 who have undergone female genital mutilation/cutting, by age group",No,
5,3,1,5-3-1,Percentage of women aged 20-24 who were married or in a union before age 15 and before age 18,No,
5,2,2,5-2-2,"Proportion of women and girls aged 15 years and older subjected to sexual violence by persons other than an intimate partner in the previous 12 months, by age and place of occurrence",No,
5,2,1,5-2-1,"Proportion of ever-partnered women and girls aged 15 years and older subjected to physical, sexual or psychological violence by a current or former intimate partner in the previous 12 months, by form of violence and by age",No,
5,1,1,5-1-1,"Whether or not legal frameworks are in place to promote, enforce and monitor equality and non-discrimination on the basis of sex",No,
6,b,1,6-b-1,Proportion of local administrative units with established and operational policies and procedures for participation of local communities in water and sanitation management,Yes,
6,a,1,6-a-1,Amount of water- and sanitation-related official development assistance that is part of a government-coordinated spending plan,No,
6,6,1,6-6-1,Change in the extent of water-related ecosystems over time,No,
6,5,2,6-5-2,Proportion of transboundary basin area with an operational arrangement for water cooperation,No,
6,5,1,6-5-1,Degree of integrated water resources management implementation (0-100),No,
6,4,2,6-4-2,Level of water stress: freshwater withdrawal as a proportion of available freshwater resources,No,
6,4,1,6-4-1,Change in water-use efficiency over time,No,
6,3,2,6-3-2,Proportion of bodies of water with good ambient water quality,No,
6,3,1,6-3-1,Proportion of wastewater safely treated,No,
6,2,1,6-2-1,"Proportion of population using safely managed sanitation services, including a hand-washing facility with soap and water",Yes,
6,1,1,6-1-1,Proportion of population using safely managed drinking water services,No,
7,b,1,7-b-1,Investments in energy efficiency as a percentage of GDP and the amount of foreign direct investment in financial transfer for infrastructure and technology to sustainable development services,No,
7,a,1,7-a-1,Mobilized amount of United States dollars per year starting in 2020 accountable towards the $100 billion commitment,Yes,
7,3,1,7-3-1,Energy intensity measured in terms of primary energy and GDP,Yes,
7,2,1,7-2-1,Renewable energy share in the total final energy consumption,No,
7,1,2,7-1-2,Proportion of population with primary reliance on clean fuels and technology,No,
7,1,1,7-1-1,Proportion of population with access to electricity,No,
8,b,1,8-b-1,Total government spending in social protection and employment programmes as a proportion of the national budgets and GDP,No,
8,a,1,8-a-1,Aid for Trade commitments and disbursements,No,
8,9,2,8-9-2,"Number of jobs in tourism industries as a proportion of total jobs and growth rate of jobs, by sex",No,
8,9,1,8-9-1,Tourism direct GDP as a proportion of total GDP and in growth rate,No,
8,8,2,8-8-2,"Increase in national compliance of labour rights (freedom of association and collective bargaining) based on International Labour Organization (ILO) textual sources and national legislation, by sex and migrant status",No,
8,8,1,8-8-1,"Frequency rates of fatal and non-fatal occupational injuries, by sex and migrant status",No,
8,7,1,8-7-1,"Proportion and number of children aged 5-17 years engaged in child labour, by sex and age",No,
8,6,1,8-6-1,"Proportion of youth (aged 15-24 years) not in education, employment or training",No,
8,5,2,8-5-2,"Unemployment rate, by sex, age and persons with disabilities",No,
8,5,1,8-5-1,"Average hourly earnings of female and male employees, by occupation, age and persons with disabilities",No,
8,4,2,8-4-2,"Domestic material consumption, domestic material consumption per capita, and domestic material consumption per GDP",No,
8,4,1,8-4-1,"Material footprint, material footprint per capita, and material footprint per GDP",Yes,
8,3,1,8-3-1,"Proportion of informal employment in non-agriculture employment, by sex",No,
8,2,1,8-2-1,Annual growth rate of real GDP per employed person,No,
8,10,2,8-10-2,Proportion of adults (15 years and older) with an account at a bank or other financial institution or with a mobile-money-service provider,No,
8,10,1,8-10-1,"Number of commercial bank branches and automated teller machines (ATMs) per 100,000 adults",No,
8,1,1,8-1-1,Annual growth rate of real GDP per capita,No,
9,c,1,9-c-1,"Proportion of population covered by a mobile network, by technology",No,
9,b,1,9-b-1,Proportion of medium and high-tech industry value added in total value added,No,
9,a,1,9-a-1,Total official international support (official development assistance plus other official flows) to infrastructure,Yes,
9,5,2,9-5-2,Researchers (in full-time equivalent) per million inhabitants,No,
9,5,1,9-5-1,Research and development expenditure as a proportion of GDP,No,
9,4,1,9-4-1,CO2 emission per unit of value added,No,
9,3,2,9-3-2,Proportion of small-scale industries with a loan or line of credit,No,
9,3,1,9-3-1,Proportion of small-scale industries in total industry value added,No,
9,2,2,9-2-2,Manufacturing employment as a proportion of total employment,No,
9,2,1,9-2-1,Manufacturing value added as a proportion of GDP and per capita,No,
9,1,2,9-1-2,"Passenger and freight volumes, by mode of transport",No,
9,1,1,9-1-1,Proportion of the rural population who live within 2 km of an all-season road,No,
10,c,1,10-c-1,Remittance costs as a proportion of the amount remitted,Yes," removed injured, relocated and evacuated persons"
10,b,1,10-b-1," Total resource flows for development, by recipient and donor countries and type of flow (e.g. official development assistance, foreign direct investment and other flows)",Yes,more detail
10,a,1,10-a-1,Proportion of tariff lines applied to imports from least developed countries and developing countries with zero-tariff,Yes,
10,7,2,10-7-2,Number of countries that have implemented well-managed migration policies,No,
10,7,1,10-7-1,Recruitment cost borne by employee as a proportion of yearly income earned in country of destination,No,
10,6,1,10-6-1,Proportion of members and voting rights of developing countries in international organizations,No,
10,5,1,10-5-1,Financial Soundness Indicators,No,
10,4,1,10-4-1,"Labour share of GDP, comprising wages and social protection transfers",No,
10,3,1,10-3-1,Proportion of the population reporting having personally felt discriminated against or harassed within the previous 12 months on the basis of a ground of discrimination prohibited under international human rights law,No,
10,2,1,10-2-1," Proportion of people living below 50 per cent of median income, by age, sex and persons with disabilities",No,
10,1,1,10-1-1,Growth rates of household expenditure or income per capita among the bottom 40 per cent of the population and the total population,No,
11,c,1,11-c-1," Proportion of financial support to the least developed countries that is allocated to the construction and retrofitting of sustainable, resilient and resource-efficient buildings utilizing local materials",No,general waste treatment removed
11,b,2,11-b-2,Number of countries with national and local disaster risk reduction strategies*,Yes,
11,b,1,11-b-1,Proportion of local governments that adopt and implement local disaster risk reduction strategies in line with the Sendai Framework for Disaster Risk Reduction 2015-2030*,No,
11,a,1,11-a-1," Proportion of population living in cities that implement urban and regional development plans integrating population projections and resource needs, by size of city",No,
11,7,2,11-7-2," Proportion of persons victim of physical or sexual harassment, by sex, age, disability status and place of occurrence, in the previous 12 months",Yes," addition of ""per GDP"""
11,7,1,11-7-1," Average share of the built-up area of cities that is open space for public use for all, by sex, age and persons with disabilities",Yes,
11,6,2,11-6-2,Annual mean levels of fine particulate matter (e.g. PM2.5 and PM10) in cities (population weighted),No,
11,6,1,11-6-1," Proportion of urban solid waste regularly collected and with adequate final discharge out of total urban solid waste generated, by cities",Yes,focus only on LDCs
11,5,2,11-5-2," Direct disaster economic loss in relation to global GDP, including disaster damage to critical infrastructure and disruption of basic servicesa",Yes,
11,5,1,11-5-1," Number of deaths, missing persons and persons affected by disaster per 100,000 peoplea",Yes,focus on local government vs. cities
11,4,1,11-4-1," Total expenditure (public and private) per capita spent on the preservation, protection and conservation of all cultural and natural heritage, by type of heritage (cultural, natural, mixed and World Heritage Centre designation), level of government (national, regional and local/municipal), type of expenditure (operating expenditure/investment) and type of private funding (donations in kind, private non-profit sector and sponsorship)",Yes,"not limited to cities over 100,000"
11,3,2,11-3-2,Proportion of cities with a direct participation structure of civil society in urban planning and management that operate regularly and democratically,Yes,"removed mention of ""perpetrator"""
11,3,1,11-3-1,Ratio of land consumption rate to population growth rate,Yes,
11,2,1,11-2-1," Proportion of population that has convenient access to public transport, by sex, age and persons with disabilities",No,
11,1,1,11-1-1," Proportion of urban population living in slums, informal settlements or inadequate housing",No,
12,c,1,12-c-1,Amount of fossil-fuel subsidies per unit of GDP (production and consumption) and as a proportion of total national expenditure on fossil fuels,No,
12,b,1,12-b-1,Number of sustainable tourism strategies or policies and implemented action plans with agreed monitoring and evaluation tools,No,
12,a,1,12-a-1,Amount of support to developing countries on research and development for sustainable consumption and production and environmentally sound technologies,Yes,
12,8,1,12-8-1,Extent to which (i) global citizenship education and (ii) education for sustainable development (including climate change education) are mainstreamed in (a) national education policies; (b) curricula; (c) teacher education; and (d) student assessment,No,
12,7,1,12-7-1,Number of countries implementing sustainable public procurement policies and action plans,Yes,
12,6,1,12-6-1,Number of companies publishing sustainability reports,No,
12,5,1,12-5-1," National recycling rate, tons of material recycled",No,
12,4,2,12-4-2," Hazardous waste generated per capita and proportion of hazardous waste treated, by type of treatment",No,
12,4,1,12-4-1," Number of parties to international multilateral environmental agreements on hazardous waste, and other chemicals that meet their commitments and obligations in transmitting information as required by each relevant agreement",No,
12,3,1,12-3-1,Global food loss index,Yes,
12,2,2,12-2-2," Domestic material consumption, domestic material consumption per capita, and domestic material consumption per GDP",Yes,
12,2,1,12-2-1,"Material footprint, material footprint per capita, and material footprint per GDP",Yes,more detail
12,1,1,12-1-1,Number of countries with sustainable consumption and production (SCP) national action plans or SCP mainstreamed as a priority or a target into national policies,No,
13,b,1,13-b-1," Number of least developed countries and small island developing States that are receiving specialized support, and amount of support, including finance, technology and capacity-building, for mechanisms for raising capacities for effective climate change-related planning and management, including focusing on women, youth and local and marginalized communities",Yes,
13,a,1,13-a-1,Mobilized amount of United States dollars per year starting in 2020 accountable towards the $100 billion commitment,Yes,
13,3,2,13-3-2," Number of countries that have communicated the strengthening of institutional, systemic and individual capacity-building to implement adaptation, mitigation and technology transfer, and development actions",No,
13,3,1,13-3-1," Number of countries that have integrated mitigation, adaptation, impact reduction and early warning into primary, secondary and tertiary curricula",No,
13,2,1,13-2-1," Number of countries that have communicated the establishment or operationalization of an integrated policy/strategy/plan which increases their ability to adapt to the adverse impacts of climate change, and foster climate resilience and low greenhouse gas emissions development in a manner that does not threaten food production (including a national adaptation plan, nationally determined contribution, national communication, biennial update report or other)",No,removed nitrogen
13,1,2,13-1-2," Number of deaths, missing persons and persons affected by disaster per 100,000 people*",Yes,
13,1,1,13-1-1,Number of countries with national and local disaster risk reduction strategies*,Yes,
14,c,1,14-c-1," Number of countries making progress in ratifying, accepting and implementing through legal, policy and institutional frameworks, ocean-related instruments that implement international law, as reflected in the United Nation Convention on the Law of the Sea, for the conservation and sustainable use of the oceans and their resources",No,
14,b,1,14-b-1,Progress by countries in the degree of application of a legal/regulatory/policy/institutional framework which recognizes and protects access rights for small-scale fisheries,No,
14,a,1,14-a-1,Proportion of total research budget allocated to research in the field of marine technology,No,
14,7,1,14-7-1," Sustainable fisheries as a percentage of GDP in small island developing States, least developed countries and all countries",No,that ignores SD
14,6,1,14-6-1," Progress by countries in the degree of implementation of international instruments aiming to combat illegal, unreported and unregulated fishing",Yes,
14,5,1,14-5-1,Coverage of protected areas in relation to marine areas,Yes,"making progress"" versus actually implementing"
14,4,1,14-4-1,Proportion of fish stocks within biologically sustainable levels,No,removed measure of SME fisheries
14,3,1,14-3-1,Average marine acidity (pH) measured at agreed suite of representative sampling stations,No,
14,2,1,14-2-1,Proportion of national exclusive economic zones managed using ecosystem-based approaches,Yes," inclusion of term ""sustainable"""
14,1,1,14-1-1,Index of coastal eutrophication and floating plastic debris density,Yes,removed subsidy mention
15,c,1,15-c-1,Proportion of traded wildlife that was poached or illicitly trafficked,Yes,
15,b,1,15-b-1,Official development assistance and public expenditure on conservation and sustainable use of biodiversity and ecosystems,No,
15,a,1,15-a-1,Official development assistance and public expenditure on conservation and sustainable use of biodiversity and ecosystems,No,
15,9,1,15-9-1,Progress towards national targets established in accordance with Aichi Biodiversity Target 2 of the Strategic Plan for Biodiversity 2011-2020,No,
15,8,1,15-8-1,Proportion of countries adopting relevant national legislation and adequately resourcing the prevention or control of invasive alien species,Yes,
15,7,1,15-7-1,Proportion of traded wildlife that was poached or illicitly trafficked,No,
15,6,1,15-6-1," Number of countries that have adopted legislative, administrative and policy frameworks to ensure fair and equitable sharing of benefits",No,
15,5,1,15-5-1,Red List Index,No,
15,4,2,15-4-2,Mountain Green Cover Index,No,
15,4,1,15-4-1,Coverage by protected areas of important sites for mountain biodiversity,Yes,
15,3,1,15-3-1,Proportion of land that is degraded over total land area,Yes,
15,2,1,15-2-1,Progress towards sustainable forest management,Yes,
15,1,2,15-1-2," Proportion of important sites for terrestrial and freshwater biodiversity that are covered by protected areas, by ecosystem type",No,
15,1,1,15-1-1,Forest area as a proportion of total land area,No,
