goal,subgoal,indicator,permalink,title,new,notes
16,b,1,16-b-1,Proportion of population reporting having personally felt discriminated against or harassed in the previous 12 months on the basis of a ground of discrimination prohibited under international human rights law,Yes,"added ""South-South"""
16,a,1,16-a-1,Existence of independent national human rights institutions in compliance with the Paris Principles,No,
16,9,1,16-9-1,"Proportion of children under 5 years of age whose births have been registered with a civil authority, by age",No,
16,8,1,16-8-1,Proportion of members and voting rights of developing countries in international organizations,No,
16,7,2,16-7-2,"Proportion of population who believe decision-making is inclusive and responsive, by sex, age, disability and population group",No,
16,7,1,16-7-1,"Proportions of positions (by sex, age, persons with disabilities and population groups) in public institutions (national and local legislatures, public service, and judiciary) compared to national distributions",No,
16,6,2,16-6-2,Proportion of the population satisfied with their last experience of public services,No,
16,6,1,16-6-1,"Primary government expenditures as a proportion of original approved budget, by sector (or by budget codes or similar)",Yes,
16,5,2,16-5-2,"Proportion of businesses that had at least one contact with a public official and that paid a bribe to a public official, or were asked for a bribe by those public officials during the previous 12 months",Yes,
16,5,1,16-5-1,"Proportion of persons who had at least one contact with a public official and who paid a bribe to a public official, or were asked for a bribe by those public officials, during the previous 12 months",No,
16,4,2,16-4-2,"Proportion of seized small arms and light weapons that are recorded and traced, in accordance with international standards and legal instruments",No,
16,4,1,16-4-1,Total value of inward and outward illicit financial flows (in current United States dollars),No,
16,3,2,16-3-2,Unsentenced detainees as a percentage of overall prison population,Yes,
16,3,1,16-3-1,Proportion of victims of violence in the previous 12 months who reported their victimization to competent authorities or other officially recognized conflict resolution mechanisms,No,
16,2,3,16-2-3,Proportion of young women and men aged 18-29 years who experienced sexual violence by age 18,No,
16,2,2,16-2-2,"Number of victims of human trafficking per 100,000 population, by sex, age and form of exploitation",No,
16,2,1,16-2-1,Percentage of children aged 1-17 who experienced any physical punishment and/or psychological aggression by caregivers in the past month,Yes,
16,10,2,16-10-2,"Number of countries that adopt and implement constitutional, statutory and/or policy guarantees for public access to information",No,
16,10,1,16-10-1,"Number of verified cases of killing, kidnapping, enforced disappearance, arbitrary detention and torture of journalists, associated media personnel, trade unionists and human rights advocates in the previous 12 months",Yes,
16,1,4,16-1-4,Proportion of people that feel safe walking alone around the area they live,No,
16,1,3,16-1-3,"Percentage of the population subjected to physical, psychological or sexual violence in the previous 12 months",No,
16,1,2,16-1-2,"Conflict-related deaths per 100,000 population (disaggregated by age group, sex and cause)",Yes,changed age range
16,1,1,16-1-1,"Number of victims of intentional homicide per 100,000 population, by age group and sex",No,
17,9,1,17-9-1,"Dollar value of financial and technical assistance (including through North-South, South- South and triangular cooperation) committed to developing countries",No,
17,8,1,17-8-1,Proportion of individuals using the Internet,No,
17,7,1,17-7-1,"Total amount of approved funding for developing countries to promote the development, transfer, dissemination and diffusion of environmentally sound technologies",Yes,
17,6,2,17-6-2,"Fixed Internet broadband subscriptions per 100 inhabitants, by speed",Yes,
17,6,1,17-6-1,"Number of science and/or technology cooperation agreements and programmes between countries, by type of cooperation",Yes,
17,6,1,17-6-1,"Number of science and/or technology cooperation agreements and programmes between countries, by type of cooperation",Yes,
17,5,1,17-5-1,Number of countries that adopt and implement investment promotion regimes for least developed countries,Yes,
17,4,1,17-4-1,Debt service as a proportion of exports of,No,
17,3,2,17-3-2,Volume of remittances (in United States dollars) as a proportion of total GDP,No,
17,3,1,17-3-1,"Foreign direct investments (FDI), official development assistance and South-South Cooperation as a proportion of total domestic budget",No,
17,2,1,17-2-1,"Net official development assistance, total and to least developed countries, as a proportion of the Organization for Economic Cooperation and Development (OECD) Development Assistance Committee donors’ gross national income (GNI)",No,
17,19,1,17-19-1,Dollar value of all resources made available to strengthen statistical capacity in developing countries,No,
17,19,2,17-19-2,Proportion of countries that (a) have conducted at least one population and housing census in the last 10 years; and (b) have achieved 100 per cent birth registration and 80 per cent death registration,No,
17,18,1,17-18-1,"Proportion of sustainable development indicators produced at the national level with full disaggregation when relevant to the target, in accordance with the Fundamental Principles of Official Statistics",No,
17,18,2,17-18-2,Number of countries that have national statistical legislation that complies with the Fundamental Principles of Official Statistics,No,
17,18,3,17-18-3,Number of countries with a national statistical,No,
17,17,1,17-17-1,Amount of United States dollars committed to public-private and civil society partnerships,No,
17,16,1,17-16-1,Number of countries reporting progress in multi-stakeholder development effectiveness monitoring frameworks that support the achievement of the sustainable development goals,No,
17,15,1,17-15-1,Extent of use of country-owned results frameworks and planning tools by providers of development cooperation,No,
17,14,1,17-14-1,Number of countries with mechanisms in place to enhance policy coherence of sustainable development,No,
17,13,1,17-13-1,Macroeconomic Dashboard,Yes,
17,12,1,17-12-1,"Leverage tariffs faced by developing countries, least developed countries and small island developing States",No,
17,11,1,17-11-1,Developing countries’ and least developed countries’ share of global exports,Yes,
17,10,1,17-10-1,Worldwide weighted tariff-average,No,
17,1,2,17-1-2,Proportion of domestic budget funded by domestic taxes,Yes,that ignores SD
17,1,1,17-1-1,"Total government revenue as a proportion of GDP, by source",No,